ID,Text,Age,Gender,Physical,Race,Religion,Others
1209,hoy babae bakit mo nilalike ang ng jowa ko pwede ba wag kang pokpok maghanap ka ng sarili mong jowa wag kang sulutera putangina mo bitch mangaagaw ka,0,1,0,0,0,0
1209,hoy babae bakit mo nilalike ang picture ng ko pwede ba wag kang pokpok maghanap ka ng sarili mong jowa wag kang sulutera putangina mo bitch mangaagaw ka,0,1,0,0,0,0
1209,hoy babae bakit mo nilalike ang picture ng jowa ko pwede ba wag kang pokpok maghanap ka ng sarili mong jowa wag kang sulutera mo bitch mangaagaw ka,0,1,0,0,0,0
1209,hoy babae bakit mo nilalike ang picture ng jowa ko pwede ba wag kang pokpok maghanap ka ng sarili mong jowa wag kang sulutera putangina mo bitch,0,1,0,0,0,0
1019,tang ina mo sana ma bankrupt ka buti nlang sa ayala ako nag grogecery doon walang ganyang paeepalan,0,0,0,0,0,1
1019,tang ina mo sm sana ma ka buti nlang sa ayala ako nag grogecery doon walang ganyang paeepalan,0,0,0,0,0,1
1019,tang ina mo sm sana ma bankrupt ka buti nlang sa ako nag grogecery doon walang ganyang paeepalan,0,0,0,0,0,1
1019,tang ina mo sm sana ma bankrupt ka buti nlang sa ayala ako nag doon walang ganyang paeepalan,0,0,0,0,0,1
1019,tang ina mo sm sana ma bankrupt ka buti nlang sa ayala ako nag grogecery doon walang ganyang,0,0,0,0,0,1
130,putcha ang panget mong babae gandang ganda ka sa sarili mo na nyandahil naiyot ka nyaulol gurang ka hayup ka,1,1,1,0,0,0
130,putcha hello ang panget mong babae ka sa sarili mo na nyandahil naiyot ka nyaulol gurang ka hayup ka,1,1,1,0,0,0
130,putcha hello ang panget mong babae gandang ganda ka sa na nyandahil naiyot ka nyaulol gurang ka hayup ka,1,1,1,0,0,0
130,putcha hello ang panget mong babae gandang ganda ka sa sarili mo na nyan dahil naiyot ka gurang ka hayup ka,1,1,1,0,0,0
130,putcha hello ang panget mong babae gandang ganda ka sa sarili mo na nyandahil naiyot ka nyaulol gurang ka,1,1,1,0,0,0
1270,mga chekwa sabi na luto na naman to e tangina nyo,0,0,0,1,0,0
1270,gagong chekwa sabi na luto na naman to e tangina nyo,0,0,0,1,0,0
1270,gagong mga chekwa luto na naman to e tangina nyo,0,0,0,1,0,0
1270,gagong mga chekwa sabi na naman to e tangina nyo,0,0,0,1,0,0
1270,gagong mga chekwa sabi na luto na naman to e,0,0,0,1,0,0
844,ang taba mo pakamatay ka sa pag papapayat dyan,0,0,1,0,0,0
844,ulol ang taba ka sa pag papapayat dyan,0,0,1,0,0,0
844,ulol ang taba mo pakamatay ka papapayat dyan,0,0,1,0,0,0
844,ulol ang taba mo pakamatay ka sa pag dyan,0,0,1,0,0,0
844,ulol ang taba mo pakamatay ka sa pag papapayat,0,0,1,0,0,0
324,mong nognog ka mamatay ka leche ka napakasinungaling mong gago ka,0,0,1,0,0,0
324,tangina nognog ka mamatay ka leche ka napakasinungaling mong gago ka,0,0,1,0,0,0
324,tangina mong nognog ka leche ka napakasinungaling mong gago ka,0,0,1,0,0,0
324,tangina mong nognog ka mamatay ka leche ka mong gago ka,0,0,1,0,0,0
324,tangina mong nognog ka mamatay ka leche ka napakasinungaling mong,0,0,1,0,0,0
2023,sa lahat e yung nasasaktan kaibigan ko dahil lang sa mga walang kwentang lalaki tangina sarap mangbugbog ng manloloko malandi,0,1,0,0,0,0
2023,ayoko sa lahat e kaibigan ko dahil lang sa mga walang kwentang lalaki tangina sarap mangbugbog ng manloloko malandi,0,1,0,0,0,0
2023,ayoko sa lahat e yung nasasaktan ko dahil lang sa mga walang kwentang lalaki tangina sarap mangbugbog ng manloloko malandi,0,1,0,0,0,0
2023,ayoko sa lahat e yung nasasaktan kaibigan ko dahil lang sa mga lalaki tangina sarap mangbugbog ng manloloko malandi,0,1,0,0,0,0
2023,ayoko sa lahat e yung nasasaktan kaibigan ko dahil lang sa mga walang kwentang lalaki tangina mangbugbog ng manloloko malandi,0,1,0,0,0,0
2049,hahaha para ka lang tanga ulol bobo panget idyoto dito may ka agh puso kotoink sorry supot alive na alive ako ikaw humihinga pa wag kang pipikit baka di ka na magising pero alam mo may dead sayo yang brain cells mo bobo,0,0,1,0,0,0
2049,hahaha para ka lang tanga ulol bobo panget idyoto dito may forever ka agh kotoink sorry supot alive na alive ako ikaw humihinga pa wag kang pipikit baka di ka na magising pero alam mo may dead sayo yang brain cells mo bobo,0,0,1,0,0,0
2049,hahaha para ka lang tanga ulol bobo panget idyoto dito may forever ka agh puso sorry supot alive na alive ako ikaw humihinga pa wag kang pipikit baka di ka na magising pero alam mo may dead sayo yang brain cells mo bobo,0,0,1,0,0,0
2049,hahaha para ka lang tanga ulol bobo panget idyoto dito may forever ka agh puso kotoink supot alive na alive ako ikaw humihinga pa wag kang pipikit baka di ka na magising pero alam mo may dead sayo yang brain cells mo bobo,0,0,1,0,0,0
2049,hahaha para ka lang tanga ulol bobo panget idyoto dito may forever ka agh puso kotoink sorry supot alive na alive ako ikaw humihinga pa baka di ka na magising pero alam mo may dead sayo yang brain cells mo bobo,0,0,1,0,0,0
1991,landi gago ang bata bata mo pa,1,1,0,0,0,0
1991,landi mo ang bata bata mo pa,1,1,0,0,0,0
1991,landi mo gago bata bata mo pa,1,1,0,0,0,0
1991,landi mo gago ang bata mo pa,1,1,0,0,0,0
1991,landi mo gago ang bata bata,1,1,0,0,0,0
2014,nakakatangina mga born again na yan kung di homophobes mga ipokrito naman pick a struggle talaga,0,0,0,0,1,0
2014,nakakatangina ng born again na yan kung di homophobes mga ipokrito naman pick a struggle talaga,0,0,0,0,1,0
2014,nakakatangina ng mga born again na yan kung di homophobes mga ipokrito pick a struggle talaga,0,0,0,0,1,0
2014,nakakatangina ng mga born again na yan kung di homophobes mga ipokrito naman struggle talaga,0,0,0,0,1,0
2014,nakakatangina ng mga born again na yan kung di homophobes mga ipokrito naman pick a struggle,0,0,0,0,1,0
1024,na pumasok hashahaha ang incompetent ng team lead namin palibhasa babae,0,1,0,0,0,0
1024,nakakatamad na hashahaha ang incompetent ng team lead namin palibhasa babae,0,1,0,0,0,0
1024,nakakatamad na pumasok hashahaha ang ng team lead namin palibhasa babae,0,1,0,0,0,0
1024,nakakatamad na pumasok hashahaha ang incompetent ng lead namin palibhasa babae,0,1,0,0,0,0
1024,nakakatamad na pumasok hashahaha ang incompetent ng team palibhasa babae,0,1,0,0,0,0
2022,kristyano cheater serve serve sa simbahan ano ka banal na cheater,0,0,0,0,1,0
2022,kristyano pero serve serve sa simbahan ano ka banal na cheater,0,0,0,0,1,0
2022,kristyano pero cheater serve sa simbahan ano ka banal na cheater,0,0,0,0,1,0
2022,kristyano pero cheater serve serve sa simbahan banal na cheater,0,0,0,0,1,0
2022,kristyano pero cheater serve serve sa simbahan ano ka banal,0,0,0,0,1,0
696,naman islam ang pasimuno ng mga terorista,0,0,0,0,1,0
696,alam mo islam ang pasimuno ng mga terorista,0,0,0,0,1,0
696,alam mo naman islam pasimuno ng mga terorista,0,0,0,0,1,0
696,alam mo naman islam ang ng mga terorista,0,0,0,0,1,0
696,alam mo naman islam ang pasimuno ng terorista,0,0,0,0,1,0
1493,to follow you back mataba ka kase,0,0,1,0,0,0
1493,i refuse to you back mataba ka kase,0,0,1,0,0,0
1493,i refuse to follow back mataba ka kase,0,0,1,0,0,0
1493,i refuse to follow you mataba ka kase,0,0,1,0,0,0
1493,i refuse to follow you back mataba ka,0,0,1,0,0,0
216,hehe bago mag tapos ang isang malutong na tangina mo pakyu gago hayup kang tangina kang pangit mo para sa mga kaibigan kong peke nambackstab sakin sa mga nanakit sakin sa may ayaw sakin papapapapapakyu kayong lahat,0,0,1,0,0,0
216,hehe bago mag tapos ang 2019 isang tangina mo pakyu gago hayup kang tangina kang pangit mo para sa mga kaibigan kong peke nambackstab sakin sa mga nanakit sakin sa may ayaw sakin papapapapapakyu kayong lahat,0,0,1,0,0,0
216,hehe bago mag tapos ang 2019 isang malutong na tangina mo pakyu gago hayup kang tangina kang pangit mo para sa mga nambackstab sakin sa mga nanakit sakin sa may ayaw sakin papapapapapakyu kayong lahat,0,0,1,0,0,0
216,hehe bago mag tapos ang 2019 isang malutong na tangina mo pakyu gago hayup kang tangina kang pangit mo para sa mga kaibigan kong peke sa mga nanakit sakin sa may ayaw sakin papapapapapakyu kayong lahat,0,0,1,0,0,0
216,hehe bago mag tapos ang 2019 isang malutong na tangina mo pakyu gago hayup kang tangina kang pangit mo para sa mga kaibigan kong peke nambackstab sakin sa mga papapapapapakyu kayong lahat,0,0,1,0,0,0
1121,putang ina mo kasumpa sumpa kang boomer ka bonak mo pakyu ka sasampalin kita ng art 3 sec 4,1,0,0,0,0,0
1121,putang ina mo drilon kang boomer ka bonak mo pakyu ka sasampalin kita ng art 3 sec 5,1,0,0,0,0,0
1121,putang ina mo drilon kasumpa sumpa boomer ka bonak mo pakyu ka sasampalin kita ng art 3 sec 6,1,0,0,0,0,0
1121,putang ina mo drilon kasumpa sumpa kang boomer ka mo pakyu ka sasampalin kita ng art 3 sec 7,1,0,0,0,0,0
1121,putang ina mo drilon kasumpa sumpa kang boomer ka bonak mo pakyu ka sasampalin kita,1,0,0,0,0,0
2098,sa insecure ka sakin hahaha kadiri kala ko ba aeta ako eh bat insecure ka sakin hahaha mas masahol ka pa sakin,0,0,0,1,0,0
2098,sa pinapakitang mong yan insecure ka sakin hahaha kadiri kala ko ba aeta ako eh bat ka sakin hahaha mas masahol ka pa sakin,0,0,0,1,0,0
2098,sa pinapakitang mong yan insecure ka sakin hahaha kadiri kala ko ba aeta ako eh hahaha mas masahol ka pa sakin,0,0,0,1,0,0
2098,sa pinapakitang mong yan insecure ka sakin hahaha kadiri kala ko ba aeta ako eh bat insecure ka sakin mas masahol ka pa sakin,0,0,0,1,0,0
2098,sa pinapakitang mong yan insecure ka sakin hahaha kadiri kala ko ba aeta ako eh bat insecure ka sakin hahaha,0,0,0,1,0,0
1951,tanginang mga sa akin nakalagay na presyo details at description ng item na binibenta ko pati location ko nilagay ko na mag ppm sa akin boss hm at loc mo,0,0,0,0,0,1
1951,tanginang mga nagppm sa akin details at description ng item na binibenta ko pati location ko nilagay ko na mag ppm sa akin boss hm at loc mo,0,0,0,0,0,1
1951,tanginang mga nagppm sa akin nakalagay na presyo ng item na binibenta ko pati location ko nilagay ko na mag ppm sa akin boss hm at loc mo,0,0,0,0,0,1
1951,tanginang mga nagppm sa akin nakalagay na presyo details at description ng pati location ko nilagay ko na mag ppm sa akin boss hm at loc mo,0,0,0,0,0,1
1951,tanginang mga nagppm sa akin nakalagay na presyo details at description ng item na binibenta ko nilagay ko na mag ppm sa akin boss hm at loc mo,0,0,0,0,0,1
159,gago lord what the fuck putangina niyo gago tarantado punyeta hayop animal putangina,0,0,0,0,1,0
159,gago lord teka fuck putangina niyo gago tarantado punyeta hayop animal putangina,0,0,0,0,1,0
159,gago lord teka what the fuck putangina gago tarantado punyeta hayop animal putangina,0,0,0,0,1,0
159,gago lord teka what the fuck putangina niyo gago tarantado punyeta animal putangina,0,0,0,0,1,0
159,gago lord teka what the fuck putangina niyo gago tarantado punyeta hayop putangina,0,0,0,0,1,0
1319,panget pakyu ka tangina mo ang bobo mo,0,0,1,0,0,0
1319,panget mo pakyu tangina mo ang bobo mo,0,0,1,0,0,0
1319,panget mo pakyu ka tangina bobo mo,0,0,1,0,0,0
1319,panget mo ka tangina mo ang bobo mo,0,0,1,0,0,0
1319,panget mo pakyu ka tangina mo,0,0,1,0,0,0
1834,tangina habang diring diri ako sa boy putangina ang dami pa niyang nakakausap na nagbebenta sa mga walker pero di ko na nabasa lahat wala lang putangina kadiri may mga ganun lalake pala talaga basta mairaos lang yung libog amputa,0,1,0,0,0,0
1834,tangina habang nababasa ko yun diring diri ako sa boy putangina ang nakakausap na nagbebenta sa mga walker pero di ko na nabasa lahat wala lang putangina kadiri may mga ganun lalake pala talaga basta mairaos lang yung libog amputa,0,1,0,0,0,0
1834,tangina habang nababasa ko yun diring diri ako sa boy putangina ang dami pa niyang sa mga walker pero di ko na nabasa lahat wala lang putangina kadiri may mga ganun lalake pala talaga basta mairaos lang yung libog amputa,0,1,0,0,0,0
1834,tangina habang nababasa ko yun diring diri ako sa boy putangina ang dami pa niyang nakakausap na nagbebenta sa mga lahat wala lang putangina kadiri may mga ganun lalake pala talaga basta mairaos lang yung libog amputa,0,1,0,0,0,0
1834,tangina habang nababasa ko yun diring diri ako sa boy putangina ang dami pa niyang nakakausap na nagbebenta sa mga walker pero di ko na nabasa lahat wala lang putangina kadiri may mga ganun lalake pala talaga yung libog amputa,0,1,0,0,0,0
1981,bobo mo kasi isa kang asong ulol ng mga chingchong na yan eh tanga,0,0,0,1,0,0
1981,bobo mo rin isa kang asong ulol ng mga chingchong na yan eh tanga,0,0,0,1,0,0
1981,bobo mo rin kasi asong ulol ng mga chingchong na yan eh tanga,0,0,0,1,0,0
1981,bobo mo rin kasi isa kang asong ulol ng mga chingchong tanga,0,0,0,1,0,0
1981,bobo mo rin kasi isa kang asong ulol ng mga chingchong na yan,0,0,0,1,0,0
865,hala e kung nilinis niyo na bobo ka ba kaya walang usad ang pinas dahil sa mga kagaya kong bobo at tanga inuna mo pa mamuna e kung kayo na naglinis keso kumuda kayo ng kumuda nakuha pang piktyuran bobo at tanga,0,0,0,0,0,1
865,hala proud pa sila na bobo ka ba kaya walang usad ang pinas dahil sa mga kagaya kong bobo at tanga inuna mo pa mamuna e kung kayo na naglinis keso kumuda kayo ng kumuda nakuha pang piktyuran bobo at tanga,0,0,0,0,0,1
865,hala proud pa sila e kung nilinis niyo na bobo ka ba kaya pinas dahil sa mga kagaya kong bobo at tanga inuna mo pa mamuna e kung kayo na naglinis keso kumuda kayo ng kumuda nakuha pang piktyuran bobo at tanga,0,0,0,0,0,1
865,hala proud pa sila e kung nilinis niyo na bobo ka ba kaya walang usad ang kong bobo at tanga inuna mo pa mamuna e kung kayo na naglinis keso kumuda kayo ng kumuda nakuha pang piktyuran bobo at tanga,0,0,0,0,0,1
865,hala proud pa sila e kung nilinis niyo na bobo ka ba kaya walang usad ang pinas dahil sa mga kagaya kong bobo at tanga inuna mo pa mamuna e kung kayo na nakuha pang piktyuran bobo at tanga,0,0,0,0,0,1
842,time talking to imbeciles like you l walang pinagaralan pokpok bobo gaga,0,1,0,0,0,0
842,waste talking to imbeciles like you l walang pinagaralan pokpok bobo gaga,0,1,0,0,0,0
842,waste of time imbeciles like you l walang pinagaralan pokpok bobo gaga,0,1,0,0,0,0
842,waste of time talking to imbeciles walang pinagaralan pokpok bobo gaga,0,1,0,0,0,0
842,waste of time talking to imbeciles like you pokpok bobo gaga,0,1,0,0,0,0
635,]kayo papaloko sa putang inang bakla yan kupal yang putang inang yan,0,1,0,0,0,0
635,wag kayo ]putang inang bakla yan kupal yang putang inang yan,0,1,0,0,0,0
635,wag kayo papaloko sa putang] bakla yan kupal yang putang inang yan,0,1,0,0,0,0
635,wag kayo papaloko sa putang inang bakla kupal putang inang yan,0,1,0,0,0,0
635,wag kayo papaloko sa putang inang bakla yan kupal yang inang,0,1,0,0,0,0
517,muslim pwede kana magyabang pakyu ka mamatay ka na,0,0,0,1,1,0
517,porket muslim magyabang pakyu ka mamatay ka na,0,0,0,1,1,0
517,porket muslim pwede kana pakyu ka mamatay ka na,0,0,0,1,1,0
517,porket muslim pwede kana magyabang mamatay ka na,0,0,0,1,1,0
517,porket muslim pwede kana magyabang pakyu ka,0,0,0,1,1,0
1545,tangina kong intsik dito sa singapore tangina sabi ba naman i visit your home when philippine become china gusto ko sapukin pero dahil boss ko sabi ko ok putangina,0,0,0,1,0,0
1545,tangina nung boss kong intsik dito sa tangina sabi ba naman i visit your home when philippine become china gusto ko sapukin pero dahil boss ko sabi ko ok putangina,0,0,0,1,0,0
1545,tangina nung boss kong intsik dito sa singapore tangina sabi ba naman i when philippine become china gusto ko sapukin pero dahil boss ko sabi ko ok putangina,0,0,0,1,0,0
1545,tangina nung boss kong intsik dito sa singapore tangina sabi ba naman i visit your home when philippine become china sapukin pero dahil boss ko sabi ko ok putangina,0,0,0,1,0,0
1545,tangina nung boss kong intsik dito sa singapore tangina sabi ba naman i visit your home when philippine become china gusto ko sapukin pero dahil boss ko,0,0,0,1,0,0
1641,sa lokohan lalaki agad sana masagasaan yung mga babaeng nag mamalinis,0,1,0,0,0,0
1641,pag dating sa lalaki agad sana masagasaan yung mga babaeng nag mamalinis,0,1,0,0,0,0
1641,pag dating sa lokohan lalaki masagasaan yung mga babaeng nag mamalinis,0,1,0,0,0,0
1641,pag dating sa lokohan lalaki agad sana mga babaeng nag mamalinis,0,1,0,0,0,0
1641,pag dating sa lokohan lalaki agad sana masagasaan yung mga babaeng,0,1,0,0,0,0
598,kabataang walang silbi sa lipunan ito ba ang pinagmamalaking millennials walang alam kundi magpabayad para sa walang kwentang gawain,1,0,0,0,0,0
598,ito ang mga kabataang ito ba ang pinagmamalaking millennials walang alam kundi magpabayad para sa walang kwentang gawain,1,0,0,0,0,0
598,ito ang mga kabataang walang silbi sa lipunan ito ba ang millennials walang alam kundi magpabayad para sa walang kwentang gawain,1,0,0,0,0,0
598,ito ang mga kabataang walang silbi sa lipunan ito ba ang pinagmamalaking millennials magpabayad para sa walang kwentang gawain,1,0,0,0,0,0
598,ito ang mga kabataang walang silbi sa lipunan ito ba ang pinagmamalaking millennials walang alam kundi magpabayad para sa,1,0,0,0,0,0
196,muslim na nagtitinda sa bangketa hindi na nga nagbabayad ng rent sila pa galit pag pinaalis umuwi na kayong probinsya tangina nyo,0,0,0,1,1,0
196,tong mga muslim na bangketa hindi na nga nagbabayad ng rent sila pa galit pag pinaalis umuwi na kayong probinsya tangina nyo,0,0,0,1,1,0
196,tong mga muslim na nagtitinda sa hindi na nga nagbabayad ng rent sila pa galit pag pinaalis umuwi na kayong probinsya tangina nyo,0,0,0,1,1,0
196,tong mga muslim na nagtitinda sa bangketa hindi na nga sila pa galit pag pinaalis umuwi na kayong probinsya tangina nyo,0,0,0,1,1,0
196,tong mga muslim na nagtitinda sa bangketa hindi na nga nagbabayad ng rent sila pa umuwi na kayong probinsya tangina nyo,0,0,0,1,1,0
1770,ang faves niyo wala sa kanila ang full attention niyo oh well what to expect sa mga baby bra warriors na bobo na di nagaaral,1,0,0,0,0,0
1770,nakakaawa ang niyo wala sa kanila ang full attention niyo oh well what to expect sa mga baby bra warriors na bobo na di nagaaral,1,0,0,0,0,0
1770,nakakaawa ang faves niyo wala sa kanila ang niyo oh well what to expect sa mga baby bra warriors na bobo na di nagaaral,1,0,0,0,0,0
1770,nakakaawa ang faves niyo wala sa kanila ang full attention niyo sa mga baby bra warriors na bobo na di nagaaral,1,0,0,0,0,0
1770,nakakaawa ang faves niyo wala sa kanila ang full attention niyo oh well what to expect sa mga baby bra warriors na bobo,1,0,0,0,0,0
2005,tangina nyo tourists na zero english wala man lang kayong baon na english o translator tapos kayo pa ang maiinis na hindi namin kayo maintindihan ano kami google mind reader,0,0,0,1,0,0
2005,tangina nyo tourists na zero english whatsoever wala man lang kayong translator tapos kayo pa ang maiinis na hindi namin kayo maintindihan ano kami google mind reader,0,0,0,1,0,0
2005,tangina nyo tourists na zero english whatsoever wala man lang kayong baon na tapos kayo pa ang maiinis na hindi namin kayo maintindihan ano kami google mind reader,0,0,0,1,0,0
2005,tangina nyo tourists na zero english whatsoever wala man lang kayong baon na english o translator tapos kayo pa ang maiinis na ano kami google mind reader,0,0,0,1,0,0
2005,tangina nyo tourists na zero english whatsoever wala man lang kayong baon na english o translator tapos kayo pa ang maiinis na hindi namin kayo maintindihan ano kami,0,0,0,1,0,0
951,mo panget na basura pa ugali uwu,0,0,1,0,0,0
951,tangina panget na basura pa ugali uwu,0,0,1,0,0,0
951,tangina mo panget basura pa ugali uwu,0,0,1,0,0,0
951,tangina mo panget na pa ugali uwu,0,0,1,0,0,0
951,tangina mo panget na basura pa,0,0,1,0,0,0
411,isang anak s inyo ha wag kau magkakalat ng lahi ninyong pangit borga ang ilong pokpok,0,1,1,0,0,0
411,hoy tama n anak s inyo ha wag kau magkakalat ng lahi ninyong pangit borga ang ilong pokpok,0,1,1,0,0,0
411,hoy tama n isang ha wag kau magkakalat ng lahi ninyong pangit borga ang ilong pokpok,0,1,1,0,0,0
411,hoy tama n isang anak s inyo ha wag kau ninyong pangit borga ang ilong pokpok,0,1,1,0,0,0
411,hoy tama n isang anak s inyo ha wag kau magkakalat ninyong pangit borga ang ilong pokpok,0,1,1,0,0,0
1684,buto mo pakyu ulol gago tanginamo putangina ka akin yan,0,0,0,0,0,1
1684,hanggang pakyu ulol gago tanginamo putangina ka akin yan,0,0,0,0,0,1
1684,hanggang buto mo pakyu ulol gago tanginamo putangina ka,0,0,0,0,0,1
1684,hanggang buto mo pakyu ulol gago tanginamo putangina yan,0,0,0,0,0,1
1684,hanggang buto mo pakyu ulol gago tanginamo putangina,0,0,0,0,0,1
97,girl stinky pussy nasty goofy old bitch find a job so you can afford hygine stuff baho amputa,1,1,1,0,0,0
97,girl shut your stinky pussy goofy old bitch find a job so you can afford hygine stuff baho amputa,1,1,1,0,0,0
97,girl shut your stinky pussy nasty old bitch find a job so you can afford hygine stuff baho amputa,1,1,1,0,0,0
97,girl shut your stinky pussy nasty goofy old bitch so you can afford hygine stuff baho amputa,1,1,1,0,0,0
97,girl shut your stinky pussy nasty goofy old bitch find a job hygine stuff baho amputa,1,1,1,0,0,0
441,tanga bobo lahat ng talino napunta sa suso,0,0,1,0,0,0
441,inutil bobo lahat ng talino napunta sa suso,0,0,1,0,0,0
441,inutil tanga bobo lahat ng talino sa suso,0,0,1,0,0,0
441,inutil tanga bobo lahat ng talino napunta suso,0,0,1,0,0,0
441,inutil tanga bobo napunta sa suso,0,0,1,0,0,0
550,nakakapunyeta katoliko kuno na kala mo kung sino magsalita laban sa simbahan pero kapag may misa hindi naman nakikinig,0,0,0,0,1,0
550,nakakapunyeta lang itong mga katoliko kung sino magsalita laban sa simbahan pero kapag may misa hindi naman nakikinig,0,0,0,0,1,0
550,nakakapunyeta lang itong mga katoliko kuno na kala mo magsalita laban sa simbahan pero kapag may misa hindi naman nakikinig,0,0,0,0,1,0
550,nakakapunyeta lang itong mga katoliko kuno na kala mo kung sino magsalita laban sa simbahan may misa hindi naman nakikinig,0,0,0,0,1,0
550,nakakapunyeta lang itong mga katoliko kuno na kala mo kung sino magsalita laban sa simbahan pero kapag may misa,0,0,0,0,1,0
157,tangina ng mga ng 5star service pero pang 12 star lang ang budget tapos gusto yung tropa na lang nilang may kaya yung sasagot sa kanila di ako nag overtime at kumuha ng 2nd and 3rd jobs para bayaran yung solo deluxe room mo sis,0,0,0,0,0,1
157,tangina ng mga taong gusto ng service pero pang 12 star lang ang budget tapos gusto yung tropa na lang nilang may kaya yung sasagot sa kanila di ako nag overtime at kumuha ng 2nd and 3rd jobs para bayaran yung solo deluxe room mo sis,0,0,0,0,0,1
157,tangina ng mga taong gusto ng 5star service pero pang lang ang budget tapos gusto yung tropa na lang nilang may kaya yung sasagot sa kanila di ako nag overtime at kumuha ng 2nd and 3rd jobs para bayaran yung solo deluxe room mo sis,0,0,0,0,0,1
157,tangina ng mga taong gusto ng 5star service pero pang 12 star lang ang tapos gusto yung tropa na lang nilang may kaya yung sasagot sa kanila di ako nag overtime at kumuha ng 2nd and 3rd jobs para bayaran yung solo deluxe room mo sis,0,0,0,0,0,1
157,tangina ng mga taong gusto ng 5star service pero pang 12 star lang ang budget tapos gusto yung tropa na lang nilang may kaya yung sasagot sa kanila di ako nag overtime at kumuha ng and jobs para bayaran yung solo deluxe room mo sis,0,0,0,0,0,1
420,na babae to feeling virgin kinantot naman ng karamihan,0,1,0,0,0,0
420,bwisit babae to feeling virgin kinantot naman ng karamihan,0,1,0,0,0,0
420,bwisit na babae to virgin kinantot naman ng karamihan,0,1,0,0,0,0
420,bwisit na babae to feeling virgin kinantot ng karamihan,0,1,0,0,0,0
420,bwisit na babae to feeling virgin kinantot naman ng,0,1,0,0,0,0
923,babaeng trying hard maglaro ng computer games para masabihan ng cool tangina niyo po,0,1,0,0,0,0
923,yung mga babaeng maglaro ng computer games para masabihan ng cool tangina niyo po,0,1,0,0,0,0
923,yung mga babaeng trying hard ng computer games para masabihan ng cool tangina niyo po,0,1,0,0,0,0
923,yung mga babaeng trying hard maglaro ng para masabihan ng cool tangina niyo po,0,1,0,0,0,0
923,yung mga babaeng trying hard maglaro ng computer games para masabihan ng tangina niyo po,0,1,0,0,0,0
478,babae does my makeup papasok nako sa homophobic era ko putangina nyo mga bakla,0,1,0,0,0,0
478,babae tas gf does my papasok nako sa homophobic era ko putangina nyo mga bakla,0,1,0,0,0,0
478,babae tas gf does my makeup nako sa homophobic era ko putangina nyo mga bakla,0,1,0,0,0,0
478,babae tas gf does my makeup papasok nako sa homophobic ko putangina nyo mga bakla,0,1,0,0,0,0
478,babae tas gf does my makeup papasok nako sa homophobic era ko putangina bakla,0,1,0,0,0,0
554,potanginang pati kape ko pinagbawal dahil walang ibang maturo dun sa zagu ako pinagiinitan pakyu matanda ka,1,0,0,0,0,0
554,potanginang manager to pati ko pinagbawal dahil walang ibang maturo dun sa zagu ako pinagiinitan pakyu matanda ka,1,0,0,0,0,0
554,potanginang manager to pati kape ko pinagbawal dahil walang ibang maturo dun sa ako pinagiinitan pakyu matanda ka,1,0,0,0,0,0
554,potanginang manager to pati kape ko pinagbawal dahil walang ibang maturo dun sa zagu ako pakyu matanda ka,1,0,0,0,0,0
554,potanginang manager to pati kape ko dahil walang ibang maturo dun sa zagu ako pinagiinitan pakyu matanda ka,1,0,0,0,0,0
391,tangina duterte marcos go panelo cayetano villar,0,0,0,0,0,1
391,tangina nyo marcos go panelo cayetano villar,0,0,0,0,0,1
391,tangina nyo duterte go panelo cayetano villar,0,0,0,0,0,1
391,tangina nyo duterte marcos go cayetano villar,0,0,0,0,0,1
391,tangina nyo duterte marcos go panelo villar,0,0,0,0,0,1
579,ba yang asawa mo parang gago ang puta walang awa,0,0,0,0,0,1
579,abnormal asawa mo parang gago ang puta walang awa,0,0,0,0,0,1
579,abnormal ba yang parang gago ang puta walang awa,0,0,0,0,0,1
579,abnormal ba yang asawa mo gago ang puta walang awa,0,0,0,0,0,1
579,abnormal ba yang asawa mo parang gago ang puta,0,0,0,0,0,1
1841,sa abs cbn bakit ito ipartner sayo seth pucha landi niya daming babae diyan mas maganda at matino bakit ito si francine na makati abs cbn ano na,0,1,0,0,0,0
1841,ewan ko sa bakit ito ipartner sayo seth pucha landi niya daming babae diyan mas maganda at matino bakit ito si francine na makati abs cbn ano na,0,1,0,0,0,0
