ID,Text,Age,Gender,Physical,Race,Religion,Others
1894,anong dont kill yourself kaya mo yan laban lang ulol pakyu eh gusto ko eh,0,0,0,0,0,1
1894,anong dont kill yourself kaya yan lang ulol pakyu eh sa ko na mmtay eh,0,0,0,0,0,1
1894,anong dont kill yourself mo lang ulol pakyu eh sa gusto ko na mmtay eh,0,0,0,0,0,1
1894,anong dont kill yourself kaya mo yan lang pakyu eh sa gusto ko mmtay eh,0,0,1,0,0,0
1894,anong dont kill yourself kaya mo yan laban lang ulol pakyu sa gusto na eh,0,0,0,0,0,1
141,bat karamihan mga naiinlove mukhang hito na mukhang aeta hahahahahahah sorry my bad,0,0,1,1,0,0
141,bat karamihan sa mga babae naiinlove sa mukhang na mukhang aeta sorry bad,0,1,1,1,0,0
141,bat karamihan sa mga babae sa hito na mukhang aeta hahahahahahah my bad,0,1,1,1,0,0
141,bat karamihan sa mga babae naiinlove na mukhang aeta hahahahahahah sorry my bad,0,1,1,1,0,0
141,bat sa mga babae naiinlove sa mukhang hito aeta hahahahahahah sorry my bad,0,1,1,1,0,0
1554,tang ina mo bong go yung sinasabi mong di mo ginagamit ung pondo ng gobyerno sa pangangampanya ha di kami kami ginagawa mong tanga,0,0,0,0,0,1
1554,tang mo bong go ano yung sinasabi mong mo ung pondo gobyerno para pangangampanya mo ha di tanga kami ung lantarang ginagawa mong tanga,0,0,0,0,0,1
1554,tang ina mo bong go ano yung mong di mo ung pondo ng para sa pangangampanya mo ha di tanga kami ung lantarang ginagawa,0,0,0,0,0,1
1554,tang ina mo bong go ano yung mong di mo ginagamit ung pondo gobyerno para sa pangangampanya ha tanga kami ung lantarang ginagawa tanga,0,0,0,0,0,1
1554,tang ina mo go ano yung sinasabi di mo ginagamit ung ng gobyerno para sa pangangampanya mo di kami ung lantarang ginagawa mong tanga,0,0,0,0,0,1
1772,yung iba nga masahol sa amoy ng bumbay o iranian,0,0,1,1,0,0
1772,yung iba nga mas pa amoy ng bumbay o iranian,0,0,1,1,0,0
1772,yung iba nga mas pa sa ng bumbay o iranian,0,0,1,1,0,0
1772,iba nga masahol pa sa amoy ng bumbay o iranian,0,0,1,1,0,0
1772,yung iba mas masahol pa sa ng bumbay o iranian,0,0,1,1,0,0
1806,tanginang arabo to nanapak yung amoy kala mo sibuyas amp,0,0,1,1,0,0
1806,tanginang arabo to nanapak yung amoy kala mo sibuyas amp,0,0,1,1,0,0
1806,arabo to nanapak yung amoy kala mo nabubulok na sibuyas,0,0,1,1,0,0
1806,tanginang to nanapak yung amoy kala mo nabubulok na sibuyas,0,0,1,1,0,0
1806,tanginang arabo to nanapak amoy kala mo nabubulok sibuyas amp,0,0,1,1,0,0
1856,may mga born na dito sa tapat ng hindi na raw kailangan ng relihiyon pagpupukpukin kayo e tirik na tirik araw anong ginagawa niyo,0,0,0,0,1,0
1856,mga again na dito sa tapat bahay na raw kailangan ng relihiyon pagpupukpukin ko kayo e na tirik ang araw anong kahibangan ginagawa niyo,0,0,0,0,1,0
1856,may mga born na maingay sa tapat bahay hindi na raw kailangan ng relihiyon pagpupukpukin ko kayo e tirik na ang araw ginagawa niyo,0,0,0,0,1,0
1856,may mga born maingay dito tapat bahay na raw kailangan ng relihiyon pagpupukpukin ko kayo e tirik na tirik araw anong kahibangan ginagawa niyo,0,0,0,0,1,0
1856,may mga born na maingay sa ng bahay na raw kailangan ng relihiyon ko kayo e tirik na tirik ang araw anong ginagawa niyo,0,0,0,0,1,0
1188,born again born again pang nalalaman sarap sapakinnetong baliw,0,0,0,0,1,0
1188,born again born again pang nalalaman uloliie sapakinnetong baliw,0,0,0,0,1,0
1188,again born again pang nalalaman uloliie sarap sapakinnetong natoh,0,0,0,0,1,0
1188,born again born again pang nalalaman sarap sapakinnetong baliw,0,0,0,0,1,0
1188,born again again pang nalalaman uloliie sapakinnetong baliw natoh,0,0,0,0,1,0
1626,aba gago ka pala masyado kang komportable sa buhay mo ngayon kaya kang maintindihan maiconsider di patas na lipunan sa mga kababaihan kang gurang ka mga ninuno mo pakyu for many more generations come,1,1,0,0,0,0
1626,aba gago pala eh masyado komportable buhay mo ngayon kaya wala kang kakayanan maintindihan maiconsider ang di patas na lipunan sa mga pakyu kang gurang ka pakyu mga ninuno mo pakyu for many generations,1,0,0,0,0,0
1626,aba gago ka pala eh komportable sa buhay mo ngayon kaya kang kakayanan maintindihan o maiconsider di patas na lipunan mga kababaihan pakyu kang gurang pakyu mga ninuno mo pakyu many more generations come,1,1,0,0,0,0
1626,aba gago pala eh masyado kang buhay mo ngayon kaya wala kang maintindihan o maiconsider ang di patas na lipunan sa mga pakyu gurang ka pakyu ninuno mo pakyu for many more to come,1,0,0,0,0,0
1626,aba gago ka pala eh masyado komportable sa buhay ngayon wala kakayanan o ang di patas na lipunan sa mga kababaihan pakyu gurang ka pakyu mga ninuno mo pakyu for many more generations come,1,1,0,0,0,0
1546,the philippines is a place china to spread their virus because using us as a fucking evacuation center tangina duterte di ka nakakatuwa kayo rin mga gagong tsino pls lang layas,0,0,0,1,0,0
1546,the philippines not a place for china to spread their because the people are using us as a evacuation center duterte ka nakakatuwa kayo rin mga gagong tsino lang layas kayo,0,0,0,1,0,0
1546,putangina the philippines is not place for china to spread virus because the people are using us as a evacuation center di ka nakakatuwa kayo mga gagong tsino pls lang layas,0,0,0,1,0,0
1546,the philippines is not a place for china to spread their because people using us as fucking evacuation center tangina duterte ka nakakatuwa kayo rin mga gagong tsino lang layas kayo,0,0,0,1,0,0
1546,putangina the philippines is not a place for china to their virus because the people us as a fucking evacuation tangina duterte ka nakakatuwa rin mga gagong pls lang layas kayo,0,0,0,1,0,0
712,ang creepy ng mga pari shutangina nyo rapists,0,0,0,0,1,0
712,ang creepy talaga ng mga shutangina nyo rapists,0,0,0,0,1,0
712,ang creepy talaga ng mga pari shutangina rapists,0,0,0,0,1,0
712,ang creepy ng mga pari shutangina nyo rapists,0,0,0,0,1,0
712,ang creepy talaga mga pari shutangina nyo rapists,0,0,0,0,1,0
1369,ha tang ina mo gumawa ka ng sarili mong audio ulol mo ka o bakit yun ang gagawin ko tang ina mo gaya gaya ka hayop ka na sakin yan,0,0,0,0,0,1
1369,ha tang ina mo gumawa ka ng sarili pro tang mo ka bakit yun gagawin ko tang mo ha gaya gaya ka lang hayop ka ginawa na sakin yan tarantado,0,0,0,0,0,1
1369,ha tang ina mo gumawa ka ng sarili pro audio tang ina ka o yun gagawin ko tang ina mo gaya gaya ka lang ka ginawa na sakin yan tarantado,0,0,0,0,0,1
1369,ha tang ina mo gumawa ng sarili mong audio tang mo ka o bakit yun ang gagawin ko tang ina ha gaya ka lang hayop ka na sakin yan tarantado,0,0,0,0,0,1
1369,ha tang mo gumawa ka ng sarili pro ulol tang ina mo ka o bakit ang gagawin ko tang ina mo ha gaya gaya ka lang hayop ginawa sakin tarantado,0,0,0,0,0,1
1023,mukhang kulang ka aruga mo tas honor student in of the best univs utak mo may talangka bobo ka bobo,0,0,0,0,0,1
1023,mukhang ka sa aruga tas honor in one of the best univs pwe utak mo may talangka bobo ka bobo,0,0,0,0,0,1
1023,mukhang ka sa aruga ng bobo mo tas honor student in of the best univs utak may talangka ka bobo,0,0,0,0,0,1
1023,kulang ka sa ng bobo mo honor student in one of the best univs mo may talangka bobo ka bobo,0,0,0,0,0,1
1023,mukhang kulang ka sa aruga ng bobo mo honor in one the best pwe mo may talangka bobo ka bobo,0,0,0,0,0,1
1813,kulto kasi yan no difference with quiboloy kaya ang daming bobo sa pinas ay same lang din sa manalo wala makain myembro nila basta maganda damit nila samba bobo at feeling magaling lang kasi yang mga,0,0,0,0,1,0
1813,kulto kasi yan no difference with quiboloy kaya bobo talaga pinas ay lang din inc ni manalo kahit wala na makain myembro basta damit nila pan samba mga bobo at feeling magaling lang kasi yang mga,0,0,0,0,1,0
1813,kulto kasi yan no with kaya ang daming talaga sa pinas ay same lang din sa ni manalo kahit wala na myembro nila damit nila pan samba mga bobo at feeling magaling lang kasi mga yan,0,0,0,0,1,0
1813,kasi yan difference with quiboloy kaya daming bobo talaga sa pinas ay same lang sa inc ni manalo kahit wala makain basta maganda damit nila pan samba bobo at feeling magaling lang kasi yang mga yan,0,0,0,0,1,0
1813,kulto yan no difference with quiboloy kaya ang daming bobo talaga sa ay same lang din sa inc ni manalo wala makain myembro nila basta maganda damit nila pan samba bobo at feeling kasi yang mga,0,0,0,0,1,0
1904,putang mangyayari ginawang not guilty yung verdict ano pero putang ina pag ginanun nga in spite of the fucking evidence ano kaya sa pinas,0,0,0,0,0,1
1904,putang ina ano kaya mangyayari pag ginawang not guilty yung verdict ina pag ginanun in spite of all the fucking ano kaya mangyayari pinas,0,0,0,0,0,1
1904,putang kaya pag ginawang guilty yung verdict ano pero ina pag ginanun nga in spite of all the fucking evidence ano kaya mangyayari pinas,0,0,0,0,0,1
1904,putang ina ano mangyayari ginawang not guilty verdict ano pero putang ina pag ginanun nga in spite of the evidence ano kaya mangyayari sa,0,0,0,0,0,1
1904,putang ina ano mangyayari pag ginawang guilty yung ano pero putang ina pag ginanun nga in spite of all evidence ano kaya mangyayari sa,0,0,0,0,0,1
1829,wala kang benepisyo sa iyo isa ka pang salot katulad ng iyong amang salot,1,0,0,0,0,1
1095,kayat hindi talaga ako nanonood ng mga anime na iyon at anuman mula sa japan mga rapist na hapon sila,0,0,0,1,0,0
175,ang pagsusulit sa patho exam ay kinuha sa impiyerno ang mga katanungan at ang silid ay napakalamig para kang kinukuha ng panginoon,0,0,0,0,1,0
1659,bobo shrek umaasa ka pa rin sa mga boto ng katoliko ako ay katoliko ngunit hindi ako kailanman iboboto ang isa sa mga lpigs na salot,0,0,0,0,1,0
590,para kang austistic kumilos amputa,0,0,1,0,0,0
1935,continental fuck you sa chingchong komunista party patay kayo sa mundo kapag natapos ito at nilulubog mo pa ang fishboat ng vietnam at may pagnanakaw ng isla pa kayong nalalaman,0,0,0,1,0,0
1681,ang iyong bobo na ingles ay hindi mo pa naintindihan ang sinabi niya nang sinabi niya,0,0,0,0,0,1
19,sobrang seryoso ang mga inc na tumakas ka sa kulto na ikaw ay mamamatay at sasabihin ko sa iyo,0,0,0,0,1,0
424,ayokong magsabu ng kahit ano ngunit kainin ninyo ang lahat ng tinala niyo sa aking anak,0,0,0,0,0,1
1450,sobrang bobo mo na hayop ka kayat ikaw lamang sana ay flinush sa inidoro kung ikay lalaking isang cheater at babaero ang lalaki ay sobrang basura,0,1,0,0,0,0
286,mas ulol ka peke ang pagiging katoliko mo tinamaan ka kasi dahil alam mong sinungaling at magnanakaw ang kandidato mo sino ba kandidato mo reveal mo nga kung proud ka,0,0,0,0,1,0
1755,ang saya diba sigaw ng sigaw ang mga kulto ni manalo mamatay ka at maimbalsamo kita,0,0,0,0,1,0
429,maaari kang magreklamo sa babae mo na nilalandi mo putangina mo malaglag ka sana sa hagdan,0,0,0,0,0,1
1630,tanginang mga kabataan na ito ang salbahe ng mga ugali ng mga kabataan ngayon hindi na marunong rumespeto,1,0,0,0,0,0
1612,patayin mo sarili mo fuck you mukha kang isang pigsa alam mo iyon,0,0,1,0,0,0
670,mayroon lamang akong isang bahagyang irita kapag ang mga baby boomer ay nagsasabi ng mga millenials kasi blahblah kahit na hindi nila ibig sabihin na manginsulto at nais lamang na magkumpara,1,0,0,0,0,0
32,pahirapan ka sana ng arabo na lima na chochopin ang ulo at iyong mga kamay at paa upang ibigay ang iyong mga lamanloob sa nangangailangan,0,0,0,1,0,0
1584,Tanginang baby bra warriors kung kumilos iisipin mo matatanda na eh pinapakain pa kayo ng pamilya niyo,1,0,0,0,0,0
723,ikaw ay isang demonyong quiboloy pakiramdam pastor ampota bobo naniniwala lamang sa iyo hangal and followers ng kjc ikaw ay isang hayop na satanas kung ikaw ay matapang harapin mo ang kaso mo sa amerika,0,0,0,0,1,0
1234,tangina mo ikaw ay bobo na panget na puro tigyawat ang makasarili mo wala kang tinutulong kaibigan wala kang kwentang kaibigan wala kang kwentang tao isa kang salot sa lipunan sanay mamatay ka na,0,0,1,0,0,0
215,ang mga millenial na ito ay walang nagawa sa mga kwento ng snapchats at ig kundi ang pagdila wala na bang ibang pwedeng gawin kaloka medyo malaswa makita,1,0,0,0,0,0
1673,pogi ka pogi ka tngna hinde pangit ikaw ay baliw na ulol pakyu tanga tanga bobo mabaliw punyeta pakshet leche pisti lintik hayop just you haup,0,0,1,0,0,0
1346,higit pang putang ina lahat ng iyong angkan gago ulol salon ng lipunan,0,0,0,0,0,1
933,ang isang panget ay tila isang kahihiyan sa arabo,0,0,1,1,0,0
327,bakit ang mga tuwid na lalaki ay laging nakakaramdam ng uhaw sa kanila.ang mga bading tangina magsabon nga ng mukha hindi nila magawa pero ang yayabang niyo parang awa niyo lang,0,1,0,0,0,0
561,napakaindemand ko ano ang ginagawa mo mukha kang isang chimpanzee na may damit,0,0,1,0,0,0
1205,tila nakakaaliw kalabanin ang mga kerries at mumurahim natin sila sa tagalog bisaya ilocano kapampangan pangasinan at waray atbp,0,0,0,1,0,0
701,halos pumatay ang mga incs upang ipagtanggol ang kulto itong ugok na ito sa halip na puksain ang apoy mas binuhusan pa ng maraming gasolina kapag nakita ko itong hayop na ito na sinasapak sa kalye siguro makikisapag din ako,0,0,0,0,1,0
1860,ang mga baby bra na mandirigma ay talagang nakakalason maglaro nalang kayo ng jackstone,1,0,0,0,0,0
1284,may isang babae sa parisan na lumapit saamin at tinitigan lamang namin siya ang ganda tapos dumating ang isang bata at nagulat ako nang makitang badjao pala,0,0,0,1,0,0
342,ang mga relihiyosong uri ng mga tao ay palaging ang pinakamasama tangina pustahan baby boomers nanaman,1,0,0,0,1,0
630,sobrang bobo mo na sobrang panget mo pa,0,0,1,0,0,0
148,sinasamba mo ang santo papa talaga ang mga katoliko na ito ay naghuhukay ng kanilang paraan sa impiyerno fucking cult shit,0,0,0,0,1,0
1520,magbabago ang aking isip hesus fucking kristo sinusumpa ko sa diyos pag isa sakanila nanalo patayin nyo ko mawawalan na ko ng pananampalataya sa sangkatauhan impossibleng masolusyuhan ang paghihirap ng isang gobyernong walang kakayahan kahit na hidni ka nagaaral,0,0,0,0,0,1
361,mga babae sa laro sa tingin mo talaga magaling tangina huwag kayo magkalat dito ang hihina niyo naman,0,1,0,0,0,0
84,pakyu kayo islam kayo ay isis abusayaf gago lumisan kayo ng Pilipinas,0,0,0,1,1,0
1507,tangina ignoranteng millennials amputa first time napanood ang titanic tangina nakakaawa naman kayo,1,0,0,0,0,0
49,ikaw ay isa pang hangal na puna kay chot ngunit si jc ay hindi makapagpupuna sa wc at hindi na mahawakan ng mga lokals ang bola nanood ka ba noon o tanga ka lang naiisip mo muna bago magkomento bobo hahaha wala kang kwenta makausap hatakin ko bigote mo eh,0,0,0,0,0,1
469,lesbian feeling fuckboy amputa may tite ka,0,1,0,0,0,0
156,mahiya ka sa iyong mukha wala akong paki kung iglesia ka walang saysay nag mga sinasabi mong ulol ka ulol tanga rin mga kakulto mo,0,0,1,0,1,0
1106,aeta kapal niya samasama kayong mukhang paa,0,0,1,1,0,0
1585,putangina ang mga kalotiko wala kayong isip puro kayo salita,0,0,0,0,1,0
1579,mamatay sana si nognog nakakainis mga sinasabi,0,0,1,1,0,0
2088,ito ay medyo mababaw ngunit may mga espesyal na lugar sa impiyerno ang mga nangiiwan pagkatapos sumang ayon sa fwb setup tanginang hit and run inaasahan kong gumamit ka ng mga condom lagi dahil nakakalungkot kung mas dumami mga lalaki tulad mo pakyu sagad hanggang mura lang kaya kong isagad hindi katulad ng tite mo,0,1,0,0,0,0
2070,putangina kang babae sana maging dalagitang ina ka,1,1,0,0,0,0
1754,sana mamatay na kayong dalawa jehova pa naman kayo tapos ang ganiyan ugali niyo,0,0,0,0,1,0
856,alam mo ikaw ay matanda na ngunit ikaw ay bobo pa rin jusmiyo panatilihin tahimik ang mga matandang hindi nagiisip,1,0,0,0,0,0
501,kingina sis lumpo ka pinapahirapan mo lang buhay ng boyfriend mo,0,0,1,0,0,0
1905,ano ang pangarap mo sa iyong buhay ang patayin ang iba't ibang mga pinoy na may dugong bicolano ilocano at marami pa,0,0,0,1,0,0
180,hoy lucy ang iyong puki ay mabaho wala kakantot sa puke ko dahil marumi at mabaho at magkakaroon ng amag hanggang sa mabulok at mamatay ka kingina mo pokpok ka na malanding bitchesa,0,1,1,0,0,0
1768,bobo ka achit putangina mo magkaiba ang nandadamay sa nagtatanong bobo ka,0,0,0,0,0,1
1895,hanggang kailan matatapos ang kawalang isip ng pinas upang makahinga naman ang bansa,0,0,0,1,0,0
926,pabiktima mahal mo mukha mo bibig mo mukhang bisaya,0,0,0,1,0,0
179,ulol ang mga matatanda na may boomer mindset kayo dahilan kaya lubog ang pilipinas sa utang nasaan na yung bbm na binoto niyo na nagsabing iaangat kayo sa kahirapan humingi kayo ng pera sakaniya,1,0,0,0,0,0
1356,patayin sa inggit ang bulag pipi at binging bashers at troll ng matamis na romantikong sandali ng aldub at hindi mo ito makita sa ibang tao na iginigiit ang kagandahan at kasikatan kay maine trueloveconquersall at ayon ang aldub,0,0,1,0,0,0
1395,si vp leni robredo ay walang kumpidensyal na pondo hindi kagaya ng iyong alkaldeng vp na maraming kumpidensyal na pondo kaya nasanay din ito dahil sainyong panatiko na kunsintidor na bobo at bulag,0,0,0,0,0,1
1743,sobra na itong negro na ito sarap turukan ng gluta,0,0,1,1,0,0
529,putangina ng mga chingchong na ito kulang nalang pati sariling tite kainin,0,0,0,1,0,0
347,tignan mo ng mabuti papanigan mong hayop ka pakyu kang baklang gurang na negatrona,0,1,0,0,0,0
1861,ulol feeling mas matalino pa tong tarantadong baklang gwardya sa korte suprema,0,1,0,0,0,0
2081,ano to gaguhan masyadong putok na putok ang lipistik ni ateng reporter na to papansin much kay koya,0,1,0,0,0,0
1327,paku ka bubwit ighost ka sana ni xiao,1,0,0,0,0,0
386,bobo chingchong fuck u gago tanga naiintindihan mo ba to haha tanga,0,0,0,1,0,0
1006,ulol ka palang katoliko ka eh di ba sabi sa 10 commandments huwag magnakaw,0,0,0,0,1,0
1103,bago ka manghusga ng iba tignan mo muna mukha mo sa salamin tangina ang panget mo tas puro tigyawat ka pa matamaan bobo,0,0,1,0,0,0
602,galaw galaw beh anuna masyadong mga unporfessional na bobong bitch bobo at tanda ba admin nyo,0,0,0,0,0,1
1138,pakyu ka ulol pldt bigla bigla nalang nawawala ng net tangina,0,0,0,0,0,1
244,alam naman natin totoong bobo si quibolor at ung kjc cult niya andaming kaso na ineenderorse si bbm huwag mo na patulan yan gurl babaligtarin ka lang niyan miyembro ako dati na umalis kasi nalaman ko na kulto salamat sa diyos umalis ako mga tanga nalang nananatili ron,0,0,0,0,1,0
2019,mukha kang pwet pakyu sagad,0,0,1,0,0,0
803,alam mong expose ka sa covid positive tas dito ka pa samin tumira tangina tanga ka ba kahit kailan hindi ka talaga nagiisip mas bobo ka pa sa mga sinasabihan mong tanga pota,0,0,0,0,0,1
1948,tangina gusto niyo ba pumatay ng bansa bakit ba nagpapapasok pa ng chingchong dito tangina gamit din sana minsan ng utak wag araw arawin pagiging bobo,0,0,0,1,0,0
1594,mga autistic ba kayo sino kakain ng lemon popsicle putangina,0,0,1,0,0,0
313,kingina ang liliit ng titi ninyo,0,0,1,0,0,0
436,etong mga manyakis na arabong to sarap barilin sa mukha,0,0,0,1,0,0
2051,tanginang bisakol na gago to mamatay ka na,0,0,0,1,0,0
137,tangina ang tatanga talaga ng mga pulitikong boomer mga takot sa kabataan,1,0,0,0,0,0
309,mongoloid panget mo tangina balik ka na sa bansa mo,0,0,1,1,0,0
431,mga magnanakaw na hinayupak tangina mo marcos,0,0,0,0,0,1
661,hirap makipag away sa english tangina tarantado,0,0,0,1,0,0
1308,kakaupo lang eh tanginang boss to nang popower trip agad gusto magpasok ng kamaganak sa kumpanya na management level agad ni hindi nga pumasa sa interview samantalang yung mga deserving dito paiyakan nung nagaapply tapos hintayan ng five ten years bago mapromote napakalaking kalokohan sobrang entitled,0,0,0,0,0,1
371,mamatay na kayo gago putangina nyong preti liners mga ulol kayo ang panget panget nyo,0,0,1,0,0,0
567,fuck these 13 year old kids pota kahit magtime travel pa ko para barilin yang bobo mong girlfriend sa susunod ksi wag pokpok,1,0,0,0,0,0
1174,tangina muntikan na ko mamatay sa atake sa puso jusko please lang wag mo imyday jowa mong maitim na mataba na panget tapos madilim pa yung picture maitim na nga beh,0,0,1,0,0,0
1384,punyeta pag makikinig ang dating daan kelangan full volume may sarili kaming diyos wag kayo istorbo sa pagtulog tangna,0,0,0,0,1,0
825,pota sana atakihin ng isis ang visayas para mawala na lahat ng bobong bisakol,0,0,0,1,0,0
182,bruha hindi ka maganda maputi ka lang ulol,0,0,1,0,0,0
1379,tangina nyong lahat tangina nyong baby bra warriors tangina ng paaralan ng homophobics tngina nyong lahat mga iyakin,1,1,0,0,0,0
622,queen of kabobohan ang peg tangina ni cynthia,0,0,0,0,0,1
967,punyeta talaga pag puro chingchong kakampi mga bobong cheater talaga,0,0,0,1,0,0
1287,tangina mo koko saka kayong mga putanginang dds magsitigil na kayo lutong luto na kayo kaka fb mga walang kwentang hangal,0,0,0,0,0,1
1544,tangina ng converge mamatay na sana may ari nyang pakyu gago pokpok manyakol tangina nyo converge pakyu,0,0,0,0,0,1
814,tangina ulol gurang uugod ugod ka na tangina mag anak ka para naman malaman mong di ka baog,1,0,1,0,0,0
1538,kaya ayaw ka pang kunin ni lord dahil masamang damo ka tangina nyong mga boomer shits may alam akong bago ng pamilya mo baka gusto mo labas ko yon para kulong kayong lahat hayop ka,1,0,0,0,0,0
1989,tangin pag sa labas feeling sosyal tan skin tawag pero pag uwi nognog lol hustisya taba mo pa lalo ulol,0,0,1,1,0,0
779,bakit ba kasi late ka na natutulog putangina kang bata ka,1,0,0,0,0,0
2011,kung habol lng ng mga lalaki ay katawan at kalandian lang aba hayop kayo tangina nyo ulol pakyu mabulok sana mga bayag niyo,0,1,1,0,0,0
297,ambisyosa si ate may pa takiptakip ng dibdib wag kang ano flat ka girl,0,0,1,0,0,0
1044,jusko pati 13 year old kong bunsong kapatid di man lang pinatawad sa pang bobody shame sarap sabunin ng bunganga mga born again pa naman ang totoxic tlga ng pamilya ng tatay ko,0,0,0,0,1,0
462,bisakol kaso tangina kaya kupal parehas boss at hr eh,0,0,0,1,0,0
1914,mga papanig sa babaeng yan tanga talaga,0,1,0,0,0,0
1271,tangina baby bra warriors lang ang bobobo talaga kausap,1,0,0,0,0,0
905,ulol tangina mo ron sa bumbay na inatake ako pakyu ka di kita magantihan andami nun tanda pa kita bobo humanda ka sakin,0,0,0,1,0,0
378,deserve na deserve talagang gaguhin ka ng mga lalake tangina ingay ingay mong babae ka no boys daw ulol pakyu pokpok,0,1,0,0,0,0
799,putanginang mga chingchong yan bakit kasi pati paniki kinakain bobo,0,0,0,1,0,0
1944,bbm na inutil na apologist propaganda,0,0,0,0,0,1
106,sa tingin mo may utak siya parang bobo na lalaki amp,0,1,0,0,0,0
127,ang bobo mo ang ang panget mo pa gago ka mamatay ka na wala kang dulot sa mundo kaya umalis ka na rito at patayin mo na sarili mo,0,0,1,0,0,0
840,bading ako pakshet wag,0,1,0,0,0,0
1986,etong mga so called na blink na to hilig mamuna tas puro away lang alam halatang mga baby bra warriors talaga tangina nitong mga to ung ginagawa ni junghwan contemporary yon te for sure di nyo alam yon puro hangin asa utak nyo eh,1,0,0,0,0,0
888,tangina ng mga kabataan na to gusto na matapos ung pandemya pero labas naman ng labas alam nyo na nga kulang ung mga gnagawa ng gobyerno tungkol sa virus tas di nyo pa gnagawa ambag nyo bilang filipino pumirmi lang kayo sa bahay ambobobo pota,1,1,0,0,0,0
1224,puro tigyawat na mabaho ang paa at mukhang ulol na may putok si angelo,0,0,1,0,0,0
991,putanginang demonyo na tangang to pag umasensyo ang pinas sa panahon ni bbm patayin mo nalang sarili mo tarantado wala ka naman batayan at ebidensya makabintang akala mo kung aino kang sira ulo ka demonyo talaga kayong mga dilawan,0,0,0,0,0,1
356,sa totoo lang kahit wala pa silang gnagawa bwisit na bwisit ka na ganito talaga yung mga batang ang sarap suntukin sa mukha,1,0,0,0,0,0
1740,ayoko talaga siraan tong ospital na to pero tangina talaga ng mga baby boomers akala nyo ba pagmamayari nyo katrabaho ninyo tangina di ko naman kasalanan nakakahanap ako ng kaibigan agad bakit ka ba nagseselos ganda ka ba,1,0,0,0,0,0
683,sa sobrang taba mo you cant follow me back ulol ka talaga,0,0,1,0,0,0
1656,kung lalaki ka magpakilala ka ikaw tong banding tangina mo,0,1,0,0,0,0
1980,defend mo pa ang dami talagang bobo dito sa nueva ecija,0,0,0,1,0,0
1667,bading ulol negro unggoy squatter ugali lasinggeri na nigger na drug pusher humanda ka sakin tanginamo ka,0,1,1,1,0,0
210,mukhang rabbit na bloated na frog na mapanlokong unggoy na mabaho tangina mo,0,0,1,0,0,0
1559,mga relihiyosong hipokrito sakalin ko kayo ng rosaryo eh,0,0,0,0,1,0
1894,gusto ko na mamatay kaya tantanan mo yung dont kill yourself laban lang shit na yan,0,0,0,0,0,1
141,bakit lahat nalang ng babae na naiinlove sa mukhang hito mukhang aeta,0,1,1,1,0,0
1554,aogn sinasabi mong di ka gagamit ng pondio ng gobyerno sa pangangampanya mo tangina mo bong go wag mo kami gawing tanga masyado na lantaran yang ginagawa mo bobo,0,0,0,0,0,1
1772,tangina mas masahol pa yung iba sa amoy ng iranian at bumbay,0,0,1,1,0,0
1806,tangina amoy nananapak na bulok na sibuyas tong arabong to,0,0,1,1,0,0
1856,tangina ng mga maiingay na born again dito sa tapat namin hindi na raw kailangan ng relihiyon tanga ba kayo tirik na tirik ang araw kahibangan nanaman gnagawa nyo pukpukin ko kayo eg,0,0,0,0,1,0
1188,sarap sakain ng baliw na to may pa born again born again pang nalalaman,0,0,0,0,1,0
1626,gago ka pala eh masyado ka kasing kumportable sa buhay mo kaya wala kang kakayahan maintindihan ang kaunfairness na dinadanas ng mga babae sa lipunan pakyu kang gurang ka pakyu mga ninuno mo at mga henerasyon nyo,1,0,0,0,0,0
1546,tangina ginagawang evacuation center ng china tong pinas para ikalat pa lalo virus nila tangina duterte hindi ka na nakakatuwa gungong nga mga tsino lumayas na kayo,0,0,0,1,0,0
712,shutangina talaga ng mga pari ang creepy mga rapists,0,0,0,0,1,0
1369,gaya gaya kang hayop ka yun pa talaga gagawin mo tangina mo akin yon tarantado gumawa ka ng sarili mong pro audio,0,0,0,0,0,1
1023,honor student sa isa sa best univs pero utak mo may talangka bobo ka mukhang kulang sa aruga,0,0,0,0,0,1
1813,kaya ang daming bobo sa pinas kasi kulto yang kjc ni quiboloy at inc ni manalo wala na makain miyembro nila basta maganda damit pang simba mga bobo feeling magaling lang,0,0,0,0,1,0
