ID,Text,Age,Gender,Physical,Race,Religion,Others
131,kadiri yung kaseat share ko na bumbay ang dugyot may slippers pa na panggirl hay what a way to start my week,0,1,0,1,0,0
1483,bobo kasi generation niyo nag settle kayo sa ganyan,1,0,0,0,0,0
331,jesus fuck ayusayusin mo naman mga pinagsasabi mo tangina how are you a full adult acting like 12 year old liptint baby bra warrior what kind of regressive fuckery is this,1,0,0,0,0,0
1239,tangina talaga ng mga millenials lahat hinahanapan ng butas amputa,1,0,0,0,0,0
467,di niyo kinalalaki pagiging dugyot at pagbabastos sa mga babae gays lol,0,1,0,0,0,0
1639,tanginang bakla at mga babae na sobrang malandi,0,1,0,0,0,0
1096,tangina nyo globe wala pa rin kaming internet,0,0,0,0,0,1
1131,umiinit ulo ko dito sa mga jehovas ah haynako sarap pagsusupalpalin,0,0,0,0,1,0
1295,no you bobo im not tanga bobo lng chingchong mag cr ko kay pabantayon ko chinlaw store,0,0,0,1,0,0
861,hoy mga garapata ang laki ba ng pagka gusto nyo ky alden mga manyakis na gurangpunyeta kakahiya,1,0,0,0,0,0
1095,kaya never talaga akong nanuod ng mga anime na yan e basta kahit ano galing sa japan mga rapist yang mga hapon na yan tangina lng nila talaga,0,0,0,1,0,0
175,putanginang patho exam yan kala mo kinuha sa impyerno yung mga tanong tapos sobrang lamig pa ng room kala ko kinukuha na ko ni lord,0,0,0,0,1,0
1659,ulol shrekasa ka pa sa catholic voteskatoliko ako pero never ko ibonoto isa man sa mga salot na lpigs,0,0,0,0,1,0
590,kung makakilos kala mo austistic amputa,0,0,1,0,0,0
1935,continental pakyu nga pala dun sa chingchong communist party putang ina ninyo lagot kayo sa mundo pag natapos ito may palubog lubog pa kayo ng fishboat ng vietnam at pangaagaw ng isla na di inyo pa kayong nalalaman hayop,0,0,0,1,0,0
1681,ang bobo mo naman english na nga di mo pa naintindihan ibig sabihin nung sinabi nya,0,0,0,0,0,1
19,putangina talaga ng mga inc seryoso lumayas na kayo sa kulto na yan mamamatay kayo dyan sinasabi ko sa inyo,0,0,0,0,1,0
424,ayoko na sana magsabi ng kung anu ano pero potah kainin niyo lahat ng pinagsasasabe niyo sa bata ko pakyu kayong lahat,0,0,0,0,0,1
1450,putangina kang gago ka apaka gago mo nimal ka sana flinush na lang kayo sa inidoro kung lalaki rin naman kayong cheater manloloko at babaero tangina men are so fckng trash,0,1,0,0,0,0
286,mas ulol ka peke ang pagiging katoliko mo tinamaan ka kasi dahil alam mong sinungaling at magnanakaw ang kandidato mo sino ba kandidato mo reveal mo nga kung proud ka,0,0,0,0,1,0
1755,ansaya dba sigaw ng sigaw ang mga kulto ni manalo buhoomamatay ka at imbalsamo kita,0,0,0,0,1,0
429,mag rant ka dun sa ka putanginahan mong gago ang landi mo tangina mo putang ina mo talaga puta ka puta ka ma hulog ka sana putangina mo,0,0,0,0,0,1
1630,tanginang mga bata to ang panget ng ugale ng mga bata ngayon wala ng respeto tangina,1,0,0,0,0,0
1612,magpakamatay ka na pakyu mukha kang pigsa lamuyon bwahahaha,0,0,1,0,0,0
670,tangina ako lang ba may slight irita when baby boomers go like mga millenials kasi blahblah even if they dont mean to insult they just wanna differentiate,1,0,0,0,0,0
32,itorture ka sana ng arabo na lima saksakin chochopin ulo kamay mo at paa tas idonate yung organs mo sa nangangailangan talaga,0,0,0,1,0,0
1584,tanginang mga baby bra warriors to kung makaasta akala mo ang tatanda na eh palamunin lng kayo ng pamilya nyo hoy,1,0,0,0,0,0
723,gago kang demonyong quiboloy feeling pastor ampota bobo na lang maniniwala sa yo bobo mga follors ng kjc isa kang kampon ni satanas hayop ka kung matapang ka harapin mo kaso mo sa amerika hindut ka,0,0,0,0,1,0
1234,tang ina mo ang bobo mo ang panget no wala kang kwento puto ka tigyawat ang selfish mo hindi ka na nakatulong wala kwentang anak wala kang kwentang kaibigan wala kang kwenta bilanh tao isa kang malaking salot sa lipunan sana mamatay ka na sana mamatay ka na tang ina,0,0,1,0,0,0
215,tong mga millenials na to wala ng ginawa sa snapchats at ig stories kundi dumila ng dumila wala na bang ibang pwedeng gawin kakaloka kayo ha medyo malaswa tingnan noh,1,0,0,0,0,0
1673,pogi ka pogi ka tngna hinde pangit mo gago ulol pakyu tanga inutil bobo buang punyeta pakshet leche pisti lintik hayop langhiya kang haup kang bobo,0,0,1,0,0,0
1346,mas putang ina buong angkan niyo hahahaahh gago ulol salon ng lipunan,0,0,0,0,0,1
933,ang panget ano daw nakakahiya sa mamang arabo,0,0,1,1,0,0
327,bakit ba feeling lagi ng mga straight na lalake na uhaw na uhaw sa kanila mga bading tangina nisimpleng mag sabon nga lang ng mukha di niyo magawa pero ang yayabang niyo please lang,0,1,0,0,0,0
561,napaka indemand ko naman ano ka jan aano pakyu mukha kang chimpanzee na may damit,0,0,1,0,0,0
1205,parang ang sarap awayin ng mga kerries tas mumurahin natin sila in tagalog bisaya ilocano kapampangan pangasinan and waray etc,0,0,0,1,0,0
701,yung mga inc halos makipagpatayan para ipagtanggol kulto etong ugok na to imbes na patayin yung apoy binuhusan pa lalo ng gasolina pag nakita ko tong hayup na to na ginugulpi sa kalye siguro pati ako makikibugbog eh,0,0,0,0,1,0
1860,sobrang toxic talaga ng mga baby bra warriors tangina niyo mag jackstone nalang kayo,1,0,0,0,0,0
1284,may lumapitna babae sa parisan namin napa titig ako shet ang ganda puta tas may dumating na bata at ung kasama nagulat ako puta badjao pala,0,0,0,1,0,0
342,these religious type of people are always the worst ones big yikes tangina pustahan mga baby boomers nanaman to pwe,1,0,0,0,1,0
630,tanga talo ka talaga bobo mo na nga panget ka pa,0,0,1,0,0,0
148,sinasamba nyo yang santo papa really these catholics are digging their way to hell fucking cult shit,0,0,0,0,1,0
1520,ill change my mind jesus fucking christ i swear to god if he wins or either one of them wins patayin niyo nalang ako really have lost faith in humanity theres no fucking way this country will solve poverty because of our incompetent government my god kahit hindi ka nagaaral,0,0,0,0,0,1
361,mga babae sa laro akala mo talaga ang galing wag kayo magkalat dito tangina ang bobobo nyo naman,0,1,0,0,0,0
84,pakyu kayo islam mga isis abusayaf gago lumayas kayo dito sa pilipinas,0,0,0,1,1,0
1507,tangina mga ignoranteng milenyal amputa first time niyo ba mapanood yung titanic tangina kawawa naman kayo kung oo,1,0,0,0,0,0
49,isa ka pang bobo na puro puna kay chot pero kabwakwan ni jc di mo punahin nung wc ni hindi na makahawak ng bola mga locals nanuod ka ba non o tanga ka lang talaga isip muna bago comment bobo hahaha wala kang kwenta kausap hilahin ko bigote mo eh lol,0,0,0,0,0,1
469,tomboy na feeling fuckboy amputa may tite ka,0,1,0,0,0,0
156,mahiya ka naman sa mukha mo la kong paki kung iglesia ka tangina walang katuturan parin mga sinasabi mo bobo ka bobo rin mga kakulto mo,0,0,1,0,1,0
1106,si aeta hahaahha kapal nya magsama sama silang mukang paa,0,0,1,1,0,0
1585,mga putangina nyo katoliko kayo mga wala kayong utak puro kayo dada,0,0,0,0,1,0
1579,jusko mamatay sana tong si nognog napakaano ng mga sinasabi,0,0,1,1,0,0
2088,medyo mababaw ata ito pero may special place in hell yung mga ghosters after agreed fwb setup tanginang hit and run i hope you fucking use condoms every time cause nakakalungkot kung dumami pa guys like you pakyu sagad hanggang mura lang yung maisasagad ko unlike your dick,0,1,0,0,0,0
2070,putangina mong babae ka sana maging batang ina ka,1,1,0,0,0,0
1754,sana mamatay na kayong dalawa ew jehova pa naman ganyan mga ugali pakyu,0,0,0,0,1,0
856,alam mo ang tanda mo na pero bobo ka pa rin jusmiyo manahimik ang mga matatandang walang utak,1,0,0,0,0,0
501,kingina sis lumpo ka pahirap ka lang sa buhay ng jowa mo,0,0,1,0,0,0
1905,ano ang pangarap mo sa iyong buhay ang pumatay ng ibat ibang lahing pinoy bicolano ilocano and many more,0,0,0,1,0,0
180,hoy lucy your pussy stinks walang kakantot sa pepe ko kasi malibag at mabaho aamagin yang pepe mo hanggang sa mabulok at mategibelz ka kingina mo pokpok ka malanding bitchesa,0,1,1,0,0,0
1768,bobo mo achit pukingina mo magkaiba yung nandamay sa nagtatanong bobo ka talaga kupal ka ulol,0,0,0,0,0,1
1895,hanggang kelan matatapos yung kabobohan ng pinas para nakapag take a breather naman kahit papano yung bansa lul,0,0,0,1,0,0
926,pavictim amputa hahaha love mo mukha mo bibig mo mukhang bisakol,0,0,0,1,0,0
179,ulol kayong matatanda mga boomer mindset ampota kaya lubog sa utang ang pilipinas dahil sainyo eh asan na yung bbm na binoto nyo na nagsabing ibabangon kayo sa hirap doon kayo umutang mga bobo,1,0,0,0,0,0
1356,patayin sa inggit ang mga bulag pipi at binging bashers and trolls ng mga sweet romantic moments ng aldub hindi nyo ito makikita sa ibang nobody na pilit nyong pinapasabit sa kagandahan kasikatan ni maine trueloveconquersall that is aldub,0,0,1,0,0,0
1395,huy tanga walang confidential funds si vp leni robredo di gaya nitong swapang mong vp mayor palang sagana na sa confidential funds kaya namihasa pinamihasa din ng mga kagaya niyong panatikong mga bobo at bulag,0,0,0,0,0,1
1743,napaka talaga nitong negro na to sarap saksakin ng gluta eh,0,0,1,1,0,0
529,putangina mga mga chingchong yan kulang na lang kainin sariling ari putangina,0,0,0,1,0,0
347,yang si negatrona pakyu kang baklang gurang tignan mo pinapanigan mong hayup ka,0,1,0,0,0,0
1861,ulol tarantado mas matalino ka pa ba sa korte suprema baklang gard,0,1,0,0,0,0
2081,putok ma putok ang lipistik ng worker na reporter anu toh gaguhan malamang palakasan kay koya,0,1,0,0,0,0
1327,putangina mo sana ighost ka ni xiao pakyu ka bubwit,1,0,0,0,0,0
386,putangina mo bobo chingchong fuck u gago tanga ka do you recognize these words hahaha,0,0,0,1,0,0
1006,diba nasa 10 commandments yung huwag magnakaw ulol ka palang katoliko anton eh,0,0,0,0,1,0
1103,bago ka manusot ng iba tignan mo muna sarili mo tangina mo ampangit ng muka mo e panay tigyawat opsszc matamaan bobo,0,0,1,0,0,0
602,anuna beh galaw galaw bobo at tanga ba mga admins nyo yall are so fcking unprofessional and dumb,0,0,0,0,0,1
1138,ulol pakyu pldt out of no where bigla kang mawala ng net,0,0,0,0,0,1
244,huwag mo ng patulan yan sis binabaligtad lang yanlam nman natin kong sinong totoong bobo quiboloy and his kjc is cult daming cases endorsing bbm i was a member b4 but left coz i found out its a cultpraise god i did it mga tanga nalang nagstastay dyan,0,0,0,0,1,0
2019,pakyu mukha kang pwet,0,0,1,0,0,0
803,kahit kailan talaga hindi ka nagiisip mas bobo ka pa sa mga sinasabihan mong bobo e alam mong expose ka sa covid positive tas dito ka samin magstay tanga ka ba,0,0,0,0,0,1
1948,bakit pa nagpasok ng mga chingchong dito gusto niyo ba pumatay ng bansa ptngina gamit din naman ng utak di inaarawaraw ang pagiging tanga,0,0,0,1,0,0
1594,unanguna sinong kakain ng lemon popsicle putangina mga autistic ba kayo,0,0,1,0,0,0
313,liit ng titi mo marko and shodai kinginamo,0,0,1,0,0,0
436,sarap barilin sa mukha ng mga manyakis na arabo pweh,0,0,0,1,0,0
2051,fuck u bisakol mamatay na tani ka ma putol tani pidoy mo gago,0,0,0,1,0,0
137,tanga talaga ng mga boomer na politician takot sa mga bata sobrang threaten,1,0,0,0,0,0
309,bitch go back to ur country mongoloid ka ang pangit mo,0,0,1,1,0,0
431,tangina niyo mga marcos mga magnanakaw na hinayupak,0,0,0,0,0,1
661,hirap makipagaway putangina di ako makasagot english kasi tarantadong negro,0,0,0,1,0,0
1308,tanginang bagong boss to kakaupo lang nangpapower trip na agad gusto magpasok ng mga kamaganak sa kumpanya management level agad hindi nga pumasa sa interview samantalang yung mga deserving dito paiyakan nung nagaapply tapos hintayan ng five ten years bago mapromote napakalaking kalokohan sobrang entitled,0,0,0,0,0,1
371,putangina mo uly ang panget panget mo mamatay na na gago isama mo si diana abecia jana and feb buong preti liners mga ulol,0,0,1,0,0,0
567,kahit magtime travel pa akot barilin ko yang lil girlfriend mo stupid dont hoe around next time den smh fuck these 13 year olds,1,0,0,0,0,0
1174,tangina flz muntik nako atakihin sa puso wag mo naman imyday jowa mong maitim na mataba na panget tapos madilim pa yung picture maitim na nga beh,0,0,1,0,0,0
1384,pagnakikinig ng dating daan sa radyo kailangan todo yung volume tangina nyo po may dyos din kami istorbo kayo sa pagtulog punyeta,0,0,0,0,1,0
825,sana atakihin ng isis yung visayas para mawala na yung mga bobong bisakol tangina,0,0,0,1,0,0
182,hoyulol di ka maganda maputi ka lang bruha,0,0,1,0,0,0
1379,fuck school fuck hetero shippers fuck iyakin na baby bra warriors tangina nyong lahat,1,1,0,0,0,0
622,putang ina pa rin ni cynthia villar queen of kabobohan ampeg e,0,0,0,0,0,1
967,punyeta talaga pag puro chingchong kakampi mukhang mga tanga,0,0,0,1,0,0
1287,putang ina mo paden koko aka bobo pimentel saka kayong mga putang inang dds kayo magsitigil na kayo lutongluto na kayo kaka facebook nyo mga hangal mga walang kwenta,0,0,0,0,0,1
1544,converge outanginamo mamatay sana founder ng converge pakyu ka gago putanginamo hayop la animal pokpok manyakol tarantado putanginanyo converge pakyu,0,0,0,0,0,1
814,ulol gurang hahahahaha muka ka ng uugod ugod mag anak ka na para malaman mong di ka baog baog hahahaha,1,0,1,0,0,0
1538,masamang damo ka kase kaya ayaw kapang kunin ni lord tangina nyong boomer kau may alam akong baho ng pamilya nyo pag un nilabas ko kulong kayo kingina nyo pakyu kang hayop ka,1,0,0,0,0,0
1989,sosyal sa labas tan skin tawag tas pag uwi nognog hustisya amputa taba mo pa lalo,0,0,1,1,0,0
779,putangina mong bata ka matulog ka na bakit ba kasi ang late mo matulog,1,0,0,0,0,0
2011,sa mga lalaki kung ang habol niyo ay kalandian at katawan lamang aba hayop ka tangina mo ulol pakyu ka balls mo mabulok sana,0,1,1,0,0,0
297,patakiptakip ka pa ng dibdib eh flat naman huwag ambisyosa teh,0,0,1,0,0,0
1044,ang totoxic talaga ng pamilya ng tatay ko pati yung 13 years old kung bunsong kapatid grabe kong i body shame sarap sabunin ang bunganga born again nga naman,0,0,0,0,1,0
462,kupal na bosskupal pa hr same vibes bisakol kase tangina hahahahaha,0,0,0,1,0,0
1914,tanga nalang talaga papanig sa babaeng yan eh,0,1,0,0,0,0
1271,ang bobo pala kausap ng mga kampon na yon hahaha baby bra warriors lang,1,0,0,0,0,0
905,shout out dun sa bumbay na inattack ako pakyu ka pasalamat ka bawal ka nang irevenge ulol ka andami nun tanda ko pangalan mo manoj s nayak,0,0,0,1,0,0
378,ingay talaga ng babaeng tinutukoy ko rito deserve na deserve mong gaguhin ka ng mga lalake tangina mo hahaha no boys daw ulol pokpok,0,1,0,0,0,0
799,bakit kasi pati paniki kinakain putangina ayan chingchong,0,0,0,1,0,0
1944,propaganda ng inutil na bbm apologist,0,0,0,0,0,1
106,parang bobo tong lalaki sa tingin mo may utak siya,0,1,0,0,0,0
127,gago ka ang bobobobo mo at ang pangit mo pa dapat mamatay ka na dahil wala kang gamit sa mundong ito dapat umalis ka na dito at patayin mo na sarili mo,0,0,1,0,0,0
840,pakshet wag po bading ako,0,1,0,0,0,0
1986,etong mga so called blinks na to ang hilig mamuna puro away alam mga baby bra warriors ba kayo ha mga tangina netong mga to contemporary yung ginawa ni junghwan te alam nyo ba yon puro hangin nasa utak ampota,1,0,0,0,0,0
888,yall want this pandemic to be over pero kayong binatat dalaga labas pa rin kayo ng labas alam niyo na yung fact na the government is not doing enough shit about the virus and you still refuse to do your job as filipinos fucking stay at home ambobobo puta,1,1,0,0,0,0
1224,may putok si angelo mazon mabaho pa paa mukha pang ulol na mukha may tigyawat,0,0,1,0,0,0
991,tanga ka tanga bobo demonyo pag umasenso at nkabawi ulet ang pilipinas sa panahon ni bongbong patayin mo nlng sarili mo tarantadong to ala k nmang batayan at ibedensya mkabintang kang cra ulo kamga demonyo tlaga kaung dilawan kau,0,0,0,0,0,1
356,ganitong klase na mga bata yung ang sarap suntukin sa mukha sa totoo lang wala pa silang ginagawa pero bwisit na bwisit ka na,1,0,0,0,0,0
1740,alam nyo i dont want to badmouth my hospital pero tangina talaga ng mga baby boomers you think you own your workmates tangina di ko kasalanan if i make friends easily bakit ka ba nagseselos jan ganda ka ba hahaha,1,0,0,0,0,0
683,ulol ka talaga sa sobrang taba mo you cant follow me back,0,0,1,0,0,0
1656,gago ikaw yung bading kung lalaki ka magpakilala ka ulol pakyu ka,0,1,0,0,0,0
1980,dami talaga bobo dito sa nueva ecija defend mo pa,0,0,0,1,0,0
1667,humanda ka sa akin tanginamong unggoy ka bading negro unggoy squatter ugali squatter pwet mo lasinggero nigger drug pusher squammy bading,0,1,1,1,0,0
210,tangina mong mukhang rabbit and mukhang bloated na frog na mapanlinlang na unggoy na mabaho,0,0,1,0,0,0
1559,sasakalin ko kayo ng rosaryo mga relihiyosong ipokrito,0,0,0,0,1,0
1894,anong dont kill yourself kaya mo yan laban lang ulol pakyu eh sa gusto ko na mmtay eh,0,0,0,0,0,1
141,bat karamihan sa mga babae naiinlove sa mukhang hito na mukhang aeta hahahahahahah sorry my bad,0,1,1,1,0,0
1554,tang ina mo bong go ano yung sinasabi mong di mo ginagamit ung pondo ng gobyerno para sa pangangampanya mo ha di kami tanga kami ung lantarang ginagawa mong tanga,0,0,0,0,0,1
1772,yung iba nga mas masahol pa sa amoy ng bumbay o iranian,0,0,1,1,0,0
1806,tanginang arabo to nanapak yung amoy kala mo nabubulok na sibuyas amp,0,0,1,1,0,0
1856,may mga born again na maingay dito sa tapat ng bahay hindi na raw kailangan ng relihiyon pagpupukpukin ko kayo e tirik na tirik ang araw anong kahibangan ginagawa niyo,0,0,0,0,1,0
1188,born again born again pang nalalaman uloliie sarap sapakinnetong baliw natoh,0,0,0,0,1,0
1626,aba gago ka pala eh masyado kang komportable sa buhay mo ngayon kaya wala kang kakayanan maintindihan o maiconsider ang di patas na lipunan sa mga kababaihan pakyu kang gurang ka pakyu mga ninuno mo pakyu for many more generations to come,1,0,0,0,0,0
1546,putangina the philippines is not a place for china to spread their virus because the people are using us as a fucking evacuation center tangina duterte di ka nakakatuwa kayo rin mga gagong tsino pls lang layas kayo,0,0,0,1,0,0
712,ang creepy talaga ng mga pari shutangina nyo rapists,0,0,0,0,1,0
1369,ha tang ina mo gumawa ka ng sarili mong pro audio ulol tang ina mo ka o bakit yun ang gagawin ko tang ina mo ha gaya gaya ka lang hayop ka ginawa na sakin yan tarantado,0,0,0,0,0,1
1023,mukhang kulang ka sa aruga ng bobo mo tas honor student in one of the best univs pwe utak mo may talangka bobo ka bobo,0,0,0,0,0,1
1813,kulto kasi yan no difference with quiboloy kaya ang daming bobo talaga sa pinas ay same lang din sa inc ni manalo kahit wala na makain myembro nila basta maganda damit nila pan samba mga bobo at feeling magaling lang kasi yang mga yan,0,0,0,0,1,0
1904,putang ina ano kaya mangyayari pag ginawang not guilty yung verdict ano pero putang ina pag ginanun nga in spite of all the fucking evidence ano kaya mangyayari sa pinas,0,0,0,0,0,1
1829,wala ka na ngang pakinabang bobo ka pang muslim ka manangmana ka sa tatay mong badjao,0,0,0,1,1,0
1829,wala ka na ngang silbi gago ka pang salot ka katulad ka sa tatay mong salot,0,0,0,0,1,0
1829,wala ka na ngang pakinabang bobo ka pang christian ka manangmana ka sa tatay mong kristiyano,0,0,0,0,1,0
1829,wala ka na ngang pakinabang bobo ka pang iglesya ka manangmana ka sa tita mong hudas,0,0,0,0,1,0
1829,wala ka na ngang pakinabang bobo ka pang pari ka manangmana ka sa lolo mong salot,1,0,0,0,1,0
1095,kaya never talaga akong nanuod ng mga anime na yan e basta kahit ano galing sa lalake mga rapist yang mga hapon na yan tangina lng nila talaga,0,1,0,1,0,0
1095,kaya never talaga akong nanuod ng mga anime na yan e basta kahit ano galing sa japan mga rapist yang mga amerikano na yan tangina lng nila talaga,0,0,0,1,0,0
1095,kaya never talaga akong nanuod ng mga anime na yan e basta kahit ano galing sa japan mga rapist yang mga singkit na yan tangina lng nila talaga,0,0,1,1,0,0
1095,kaya never talaga akong nanuod ng mga anime na yan e basta kahit ano galing sa japan mga rapist yang mga afam na yan tangina lng nila talaga,0,0,0,1,0,0
1095,kaya never talaga akong nanuod ng mga moreno na yan e basta kahit ano galing sa japan mga rapist yang mga Vietnamese na yan tangina lng nila talaga,0,0,1,1,0,0
175,putanginang arabo exam yan kala mo kinuha sa impyerno yung mga tanong tapos sobrang lamig pa ng room kala ko kinukuha na ko ni lord,0,0,0,1,1,0
175,putanginang koreanong exam yan kala mo kinuha sa impyerno yung mga tanong tapos sobrang lamig pa ng room kala ko kinukuha na ko ni satanas,0,0,0,1,1,0
175,putanginang patho exam yan kala mo kinuha sa impyerno yung mga tanong tapos sobrang lamig pa ng room kala ko kinukuha na ko ni satan,0,0,0,0,1,0
175,putanginang kristyan exam yan kala mo kinuha sa impyerno yung mga tanong tapos sobrang lamig pa ng room kala ko kinukuha na ko ni father,0,0,0,1,1,0
175,putanginang patho exam yan kala mo kinuha sa impyerno yung mga tanong tapos sobrang lamig pa ng room kala ko kinukuha na ko ni kulto,0,0,0,0,1,0
1659,ulol mongoloid asa ka pa sa catholic votes katoliko ako pero never ko ibonoto isa man sa mga salot na lpigs,0,0,1,0,1,0
1659,ulol shokoy asa ka pa sa kristian votes kristiyano ako pero never ko ibonoto isa man sa mga salot na lpigs,0,0,1,0,1,0
1659,ulol bulag asa ka pa sa islam votes islam ako pero never ko ibonoto isa man sa mga salot na lpigs,0,0,1,0,1,0
1659,ulol abnormal asa ka pa sa muslim votes muslim ako pero never ko ibonoto isa man sa mga salot na lpigs,0,0,1,0,1,0
1659,ulol monggoloyd asa ka pa sa iglesia votes iglesya ako pero never ko ibonoto isa man sa mga salot na lpigs,0,0,1,0,1,0
590,kung makakilos kala mo chanak amputa,0,0,1,0,0,0
590,kung makakilos kala mo siraulo amputa,0,0,1,0,0,0
590,kung makakilos kala mo baboy amputa,0,0,1,0,0,0
590,kung makakilos kala mo millenial amputa,1,0,0,0,0,0
590,kung makakilos kala mo santo papa amputa,0,0,0,0,1,0
1935,continental pakyu nga pala dun sa chingchong communist party putang ina ninyo lagot kayo sa mundo pag natapos ito may palubog lubog pa kayo ng fishboat ng vietnam at pangaagaw ng isla na di inyo pa kayong nalalaman hayop,0,0,0,1,0,0
1935,continental pakyu nga pala dun sa bumbai communist party putang ina ninyo lagot kayo sa mundo pag natapos ito may palubog lubog pa kayo ng fishboat ng vietnam at pangaagaw ng isla na di inyo pa kayong nalalaman hayop,0,0,0,1,0,0
1935,continental pakyu nga pala dun sa koreano communist party putang ina ninyo lagot kayo sa mundo pag natapos ito may palubog lubog pa kayo ng fishboat ng vietnam at pangaagaw ng isla na di inyo pa kayong nalalaman hayop,0,0,0,1,0,0
1935,continental pakyu nga pala dun sa hapon communist party putang ina ninyo lagot kayo sa mundo pag natapos ito may palubog lubog pa kayo ng fishboat ng vietnam at pangaagaw ng isla na di inyo pa kayong nalalaman hayop,0,0,0,1,0,0
1935,continental pakyu nga pala dun sa badjao communist party putang ina ninyo lagot kayo sa mundo pag natapos ito may palubog lubog pa kayo ng fishboat ng vietnam at pangaagaw ng isla na di inyo pa kayong nalalaman hayop,0,0,0,1,0,0
1681,ang autistic mo naman english na nga di mo pa naintindihan ibig sabihin nung sinabi nya,0,0,1,0,0,0
1681,ang nakakasuya mo naman tagalog na nga di mo pa naintindihan ibig sabihin nung sinabi nya,0,0,1,0,0,0
1681,ang kadiri mo naman english na nga di mo pa naintindihan ibig sabihin nung sinabi nya,0,0,1,0,0,0
1681,ang bingi mo naman english na nga di mo pa naintindihan ibig sabihin nung sinabi nya,0,0,1,0,0,0
1681,ang boomer mo naman english na nga di mo pa naintindihan ibig sabihin nung sinabi nya,1,0,0,0,0,0
19,putangina talaga ng mga muslim seryoso lumayas na kayo sa kulto na yan mamamatay kayo dyan sinasabi ko sa inyo,0,0,0,0,1,0
19,putangina talaga ng mga islam seryoso lumayas na kayo sa kulto na yan mamamatay kayo dyan sinasabi ko sa inyo,0,0,0,0,1,0
19,putangina talaga ng mga intsik seryoso lumayas na kayo sa kulto na yan mamamatay kayo dyan sinasabi ko sa inyo,0,0,0,1,1,0
19,putangina talaga ng mga islam seryoso lumayas na kayo sa kulto na yan mamamatay kayo dyan sinasabi ko sa inyo,0,0,0,0,1,0
19,putangina talaga ng mga chinese seryoso lumayas na kayo sa kulto na yan mamamatay kayo dyan sinasabi ko sa inyo,0,0,0,1,1,0
424,ayoko na sana magsabi ng kung anu ano pero potah kainin niyo lahat ng pinagsasasabe niyo sa anak ko pakyu kayong lahat,1,0,0,0,0,0
424,ayoko na sana magsabi ng kung anu ano pero potah kainin niyo lahat ng pinagsasasabe niyo sa lolo ko pakyu kayong lahat,1,0,0,0,0,0
424,ayoko na sana magsabi ng kung anu ano pero potah kainin niyo lahat ng pinagsasasabe niyo sa henerasyon ko tarantado kayong lahat,1,0,0,0,0,0
424,ayoko na sana magsabi ng kung anu ano pero potah kainin niyo lahat ng pinagsasasabe niyo sa nanay ko masunog kayong lahat,1,0,0,0,0,0
424,ayoko na sana magsabi ng kung anu ano pero potah kainin niyo lahat ng pinagsasasabe niyo sa lola ko malumpo kayong lahat,1,0,0,0,0,0
1450,putangina kang homophobic ka apaka baho mo nimal ka sana flinush na lang kayo sa inidoro kung lalaki rin naman kayong cheater manloloko at babaero tangina men are so fckng trash,0,1,1,0,0,0
1450,putangina kang baboy ka apaka liit mo nimal ka sana flinush na lang kayo sa inidoro kung lalaki rin naman kayong cheater manloloko at babaero tangina boys are so fckng trash,0,1,1,0,0,0
1450,putangina kang babae ka apaka gago mo gold digger ka sana flinush na lang kayo sa inidoro kung lalaki rin naman kayong cheater manloloko at lalakero tangina women are so fckng retarded,0,1,1,0,0,0
1450,putangina kang gago ka apaka gago mo nimal ka sana flinush na lang kayo sa inidoro kung tatanda rin naman kayong bulag bingi at pokpok tangina gen x are so fckng trash,1,1,1,0,0,0
1450,putangina kang manang ka apaka bitchesa mo nimal ka sana flinush na lang kayo sa inidoro kung tatanda rin naman kayong hindot obese at mapanghe tangina boomers are so fckng trash,1,1,1,0,0,0
286,mas ulol ka peke ang pagiging kristyan mo tinamaan ka kasi dahil alam mong sinungaling at magnanakaw ang kandidato mo sino ba kandidato mo reveal mo nga kung proud ka,0,0,0,0,1,0
286,mas ulol ka peke ang pagiging makadiyos mo tinamaan ka kasi dahil alam mong sinungaling at magnanakaw ang kandidato mo sino ba kandidato mo reveal mo nga kung proud ka,0,0,0,0,1,0
